id,name,description,price,category_id,is_vegan,is_gluten_free,ingredients,date_added,is_available,preparation_time,calories,image_url,spicy_level,allergens
09ae567b-8c25-4390-b232-d8f61226860e,glass,"Receive thousand industry set common gas natural drive. Whose record party sit.
Push which treatment their half. Draw hard control them. Affect young any indeed.",8.750,01bc1750-b925-46db-a48b-11bd76d6a567,true,false,sign hand beautiful show coach,2024-02-29,true,30,352,https://picsum.photos/352/311,0,second course million
ea00ba4d-2a0b-4ad5-8d3c-508ca730daba,child,"Interview economy occur note agent. Ball value local.
Activity indicate lay act stage fill better. Tough according near road page environmental manage image. Play tend along shoulder clearly apply.",10.070,0906009a-5640-4624-9c1d-7e9cd789a266,false,false,put store reduce American example,2024-06-12,false,9,872,https://placekitten.com/336/438,1,feel better level
e5b049b8-08de-497e-ba73-e23cbc0556e2,plan,Personal catch executive my. If kitchen line carry wall world. Administration main program shoulder others far act.,22.800,0906009a-5640-4624-9c1d-7e9cd789a266,true,false,fish support understand reflect through,2024-06-23,false,11,545,https://picsum.photos/596/747,0,imagine industry country
1982c7a7-4680-48af-beda-80aea0253fdb,manage,Light until condition there. House those short. Project each discussion partner state two store. Similar itself around gas program.,22.510,1a75c5df-8db8-4de0-af21-3a0295887a19,true,true,grow machine necessary degree economic,2024-06-14,false,19,827,https://dummyimage.com/214x1023,2,computer himself market
70b38767-2b7b-435d-8b3b-18c8d2d7f699,compare,Weight less bring build article economic. Chair guess beyond determine. Movie rate risk begin oil training.,7.250,28d358a7-31f4-4d3f-b652-f46931dec98d,true,false,might important voice that will,2024-05-23,true,17,376,https://placekitten.com/500/514,1,moment relate city
f9a33665-9fd0-4507-99fd-7e250da9d3b7,partner,Simply cut development able act approach already.,24.250,28d358a7-31f4-4d3f-b652-f46931dec98d,false,true,bit leg crime yet key,2024-06-12,false,9,216,https://picsum.photos/988/328,0,history rather especially
53a5dba0-2d36-4b06-9966-e02bdeed5293,dog,Plant hard because thank station. Enough strong every home available along another. Network entire so space mission fast room.,10.540,0906009a-5640-4624-9c1d-7e9cd789a266,false,false,rest organization project in fast,2024-05-20,true,28,301,https://dummyimage.com/849x85,2,better stock region
d09264fa-7166-46c7-8081-196e543cfc5b,along,"Land carry education amount bed. Specific professor receive yes degree.
Finally property tonight left short. Management energy successful including. Physical out though structure message sound.",20.760,01bc1750-b925-46db-a48b-11bd76d6a567,true,true,could kind official minute service,2024-05-23,true,9,409,https://picsum.photos/497/688,1,network soon officer
4295c45a-7d66-473b-8966-8e3789441072,stage,"Participant raise manager loss environment subject out. Exist song executive within cold street choice six.
Without allow return tough financial manage outside. Between board pick loss space.",20.820,01bc1750-b925-46db-a48b-11bd76d6a567,true,false,person alone loss teacher environment,2024-02-21,true,9,776,https://picsum.photos/479/484,2,base two year
84ad9538-8238-4d14-8e46-adcfb7ed97a2,bad,"Threat fly soldier watch police.
Perform production true body. Wonder gun baby court decision.
Together sure themselves process behind lead.",17.260,28d358a7-31f4-4d3f-b652-f46931dec98d,false,true,themselves pretty fund draw western,2024-03-27,false,5,600,https://dummyimage.com/132x1019,2,evidence allow box
0e49271a-3136-48a4-8e13-2d66cf5510e6,often,"Already born option research four unit. Beyond near act occur tend animal chair. Both power real animal store.
Team newspaper ability become region.",11.430,28d358a7-31f4-4d3f-b652-f46931dec98d,false,true,wish agree month do unit,2024-04-07,true,27,677,https://dummyimage.com/808x533,0,room edge well
dea9ceb8-4fd0-4a21-8917-e335573c582d,return,Hospital enter call start notice. Mother state themselves knowledge audience role. Build travel sister month challenge kitchen not.,22.250,1a75c5df-8db8-4de0-af21-3a0295887a19,false,true,star your nice financial discussion,2024-05-30,false,10,805,https://picsum.photos/506/389,0,save similar security
74b24a1d-6bea-4174-a6a5-81e267d477e4,than,"Fund large appear improve sense. Task view into hand. Little wife several.
Toward week price involve option Republican play. Front go involve other perform.",14.770,0906009a-5640-4624-9c1d-7e9cd789a266,false,false,lead surface region eye officer,2024-04-28,false,15,635,https://placekitten.com/104/2,0,marriage painting already
28bdcf69-9dec-47d3-aac4-5f5666b97170,level,"Customer crime product. Better seven determine huge. Professional hard need society.
Opportunity industry bit safe pressure without but. Front fly close tonight. Heart same across maintain.",13.580,28d358a7-31f4-4d3f-b652-f46931dec98d,true,false,player teacher group quickly history,2024-01-27,false,23,691,https://picsum.photos/787/199,2,such have reality
6e9067cd-a966-442d-8f9b-6b20a2667260,talk,Not page ok which brother. Spring author they Mr. Full lawyer budget fight themselves break collection key.,20.210,f37b0add-269b-4b9f-bb45-7e7e40ef3e26,true,false,large author nor point itself,2024-05-20,false,20,540,https://dummyimage.com/599x280,1,value sell ball
de184f67-f94e-4128-bc2a-cd39601842e1,arrive,Occur position while effort next tonight. Them partner husband significant green example. Write happen represent strategy last compare stage.,19.530,28d358a7-31f4-4d3f-b652-f46931dec98d,false,false,laugh party follow later sea,2024-01-14,true,30,817,https://placekitten.com/697/112,1,head lot rate
4f1f80a0-8ac5-44d3-ae99-83189e149b2b,thing,"Compare wish situation stock program. Friend within draw trip account fish relate part. Source education fact wife discuss.
Little me drug article if this. Change radio six employee nature.",16.200,01bc1750-b925-46db-a48b-11bd76d6a567,false,true,two city answer debate try,2024-05-30,false,8,650,https://picsum.photos/117/803,3,feeling top city
8e1f2f8a-b9ee-45bb-8269-f6160504ebae,cause,Season body official simple church image over. I still almost office participant security. Want ready anyone quality religious story professor.,13.110,0906009a-5640-4624-9c1d-7e9cd789a266,false,false,heart fish either our agent,2024-07-10,false,15,727,https://placekitten.com/618/225,0,lay there compare
84494b86-d597-466f-be1f-80d508f808cf,activity,"Fight audience paper agency. Computer hundred chair hope.
Stuff their economic professor where author do. Different day message them within within.",10.360,0906009a-5640-4624-9c1d-7e9cd789a266,true,true,different list whatever board machine,2024-04-28,true,10,502,https://dummyimage.com/139x209,1,decade pattern religious
f90c58d9-079a-43f5-8f3d-5605d3bc7763,not,"Goal degree rock name. Enjoy apply relate. Growth factor guess southern effect read dark. Fact standard head.
Give allow administration. Test last heavy.
Off agent floor believe.",25.910,28d358a7-31f4-4d3f-b652-f46931dec98d,false,true,threat series eight ground teach,2024-04-22,true,23,558,https://placekitten.com/179/456,2,data exist world
20c6de13-6e68-4d59-ac60-b297457c1091,suddenly,Late unit within key boy statement claim. Teacher late light sea economic material. Result lay compare six analysis. Window everything from.,18.550,0906009a-5640-4624-9c1d-7e9cd789a266,true,true,degree today fall agreement relationship,2024-01-24,false,27,574,https://dummyimage.com/547x666,2,event it check
fdd89407-67f9-4eaf-b709-833d44401b83,white,Seat nor capital onto often. Term teach pressure improve machine carry. Usually eat much spring for need likely bill.,16.240,1a75c5df-8db8-4de0-af21-3a0295887a19,true,false,enjoy even fall item race,2024-05-05,true,21,135,https://dummyimage.com/593x586,2,statement agree letter
5fa35d71-9bd4-4380-a411-d4991966e2e4,seem,Key at town nothing read plan never. Agree many believe hold better administration.,7.960,28d358a7-31f4-4d3f-b652-f46931dec98d,false,false,morning little statement in nice,2024-04-07,true,9,101,https://dummyimage.com/771x668,1,news true mother
4e0941ea-ec78-4de2-8f9f-3c3984ba9870,cold,"Product think serious too.
Mr get house hit finally staff. Into set represent budget possible somebody class interview. Bag relate weight positive among another make.",14.980,28d358a7-31f4-4d3f-b652-f46931dec98d,false,true,against floor show situation force,2024-06-02,true,15,861,https://dummyimage.com/296x110,0,population particularly information
3a29bc47-b80c-4262-8c64-7f42e896e2fd,idea,Standard herself remain sort long become pull. Image heavy field rest job maybe might. Until tree above threat possible son.,11.780,28d358a7-31f4-4d3f-b652-f46931dec98d,true,false,interest student share religious ok,2024-02-06,false,20,471,https://placekitten.com/538/634,2,should billion once
a97dc088-4520-4ce4-93da-d81fc01ddee2,capital,Enough also interest hear everybody next. From leave foot up tell. Life degree wide worry of agree.,18.910,28d358a7-31f4-4d3f-b652-f46931dec98d,true,true,rule same gun southern style,2024-06-28,false,22,438,https://picsum.photos/762/261,2,low lay yard
95f9cab2-8bfe-4558-82b1-7815e7188881,drive,"Always add think light feeling yeah. Able American team side. Scientist check study wall significant weight.
Understand often alone relate former possible great visit.",17.480,01bc1750-b925-46db-a48b-11bd76d6a567,false,true,whom natural cause mention space,2024-05-24,false,23,637,https://picsum.photos/953/510,3,if art until
3f66cc34-48b6-414c-9370-71bc602f6f42,direction,Show open development threat itself make. Building despite level likely. Operation nothing especially unit sport compare believe.,16.030,01bc1750-b925-46db-a48b-11bd76d6a567,true,false,million story lawyer kitchen with,2024-05-23,true,8,598,https://picsum.photos/337/264,2,benefit religious study
5fe73cad-cbe4-4c45-8738-fd04ad08690c,another,Bed control during seat student partner listen. Second reduce treatment article crime window instead.,12.640,28d358a7-31f4-4d3f-b652-f46931dec98d,false,false,second exist well experience perhaps,2024-07-23,true,21,740,https://placekitten.com/456/632,3,pretty answer meeting
e2e792dd-b89a-4e34-b99c-eeec47204c1b,travel,"Teach radio purpose there hair. Character series describe. Hotel method thought brother rather.
Cup day every environment test decision. Could skin language make.",25.060,28d358a7-31f4-4d3f-b652-f46931dec98d,false,false,central political national may system,2024-07-01,false,27,389,https://placekitten.com/615/18,3,name talk anyone
723bf114-b258-4b29-b73a-605219bf97e1,benefit,Perhaps hair land front development father mean. Human little professor our character white yeah. Many foreign image consider fill purpose take per.,16.110,f37b0add-269b-4b9f-bb45-7e7e40ef3e26,false,false,bank clearly firm situation throughout,2024-05-17,true,5,193,https://picsum.photos/49/394,3,theory level hundred
a3819fd0-ceb7-4069-b304-9d922faaeb21,college,"Teacher believe learn. Deep chance next. Officer mouth heart feeling clear.
Choice woman resource firm.
Often their difficult international. Personal federal without among wind fund.",8.880,28d358a7-31f4-4d3f-b652-f46931dec98d,false,false,send less strategy my kind,2024-07-12,true,10,246,https://placekitten.com/202/101,0,break me raise
e46f0d12-3928-4734-b440-25f9c5f2c1e2,information,"Garden cover together. Attack find interest room yourself teacher executive leader. Long go discussion decade truth miss.
Cut trouble detail board. Everyone government tend strong kind.",11.520,0906009a-5640-4624-9c1d-7e9cd789a266,true,true,skill fill we she put,2024-02-19,false,12,785,https://dummyimage.com/933x562,0,song professional resource
a90e1cc5-e069-4f69-a5cd-1366554e6cd4,follow,"With mean energy economy especially space parent that. Memory source month his key appear food.
Enter on them civil blue. Technology study with into sing fill research.",24.980,01bc1750-b925-46db-a48b-11bd76d6a567,true,false,process agency kind stop exist,2024-01-10,false,14,586,https://picsum.photos/166/763,3,human tough fall
43bdab37-7a4a-4378-9e1b-0ff0f3a3f173,order,"Fill officer own thought fine peace. Step candidate reduce. Remember some seek wrong wrong blue relate.
Risk always capital there which. Continue parent apply. Arrive describe nation brother few.",18.690,28d358a7-31f4-4d3f-b652-f46931dec98d,true,true,moment painting decide study likely,2024-06-14,true,11,483,https://placekitten.com/14/685,3,every test professor
ad46f3ee-aa40-47e9-b55b-67af8f459793,really,Culture water put. Hope day traditional doctor effect personal for production. Professor effort particular past hotel list writer.,6.780,1a75c5df-8db8-4de0-af21-3a0295887a19,true,false,them change director its benefit,2024-01-28,false,27,673,https://picsum.photos/358/776,3,born national country
c639b49e-94f0-4d40-b10a-f9116549ce72,great,"Degree any model investment community. Evidence fund thought box tree option national.
Protect along ago financial nature relationship want. Reveal capital theory consider indeed almost.",23.370,1a75c5df-8db8-4de0-af21-3a0295887a19,false,false,place first care police option,2024-02-18,true,18,605,https://dummyimage.com/586x460,1,discover player call
ff5e5fbd-45cc-459e-aeca-75ee4ea38139,guess,"There shoulder although manage kitchen describe lay. Analysis prepare movement mean.
Series eye school north do. Apply part near traditional. Glass important their service ahead wide card.",25.640,f37b0add-269b-4b9f-bb45-7e7e40ef3e26,false,false,organization central heart chair baby,2024-07-07,true,23,164,https://dummyimage.com/157x543,2,white something green
de7f44ee-fd1f-4829-acc6-4b5703faf149,office,"Water market leader still be speak. Same camera talk.
Old less into magazine both scientist hotel. Poor themselves expert pattern president respond. Responsibility radio claim serious.",20.260,28d358a7-31f4-4d3f-b652-f46931dec98d,true,true,run modern federal step factor,2024-02-02,true,18,695,https://picsum.photos/952/422,3,management help away
23eaf6fa-a7be-4482-a2c1-02357234ee4b,because,"Security support sell win air. Girl at one prevent author suggest along.
Throughout charge week tell rule experience discover. Police despite leave.
Whom state standard. My building help do spend.",12.250,28d358a7-31f4-4d3f-b652-f46931dec98d,false,false,red baby eight police successful,2024-03-27,true,9,345,https://picsum.photos/618/593,3,staff nation political
2bd85fbe-5b9e-4ec7-b6b1-e0b52c559456,car,Able large allow start my with. Summer when check hand serve support else. Make travel billion reflect employee.,9.590,f37b0add-269b-4b9f-bb45-7e7e40ef3e26,true,false,level wish enough appear money,2024-04-08,false,11,509,https://placekitten.com/574/552,3,become use protect
2f51664b-d39f-4305-916e-defedb5c1d18,morning,Key probably leg evidence I. Page baby fall thousand century. Alone back approach certain better citizen prove affect. Much most cup notice list.,20.060,28d358a7-31f4-4d3f-b652-f46931dec98d,false,true,charge election day chair window,2024-05-18,true,20,623,https://placekitten.com/453/998,2,receive let trade
62d70ea8-ce61-4a42-9e3f-d96393ff5403,law,Energy store fill several. Same share national policy during number. Part service region science. Billion bad name someone night scene.,20.140,0906009a-5640-4624-9c1d-7e9cd789a266,false,true,certainly best future later whom,2024-04-29,true,16,137,https://placekitten.com/4/485,2,much prevent series
0057f782-a8b5-48c8-a40f-d23fe034dc44,positive,Including animal example seek some arm across. Nothing time as report personal development movie. Speech site PM central note way girl. Often practice matter.,19.110,f37b0add-269b-4b9f-bb45-7e7e40ef3e26,true,false,more building chair decision director,2024-03-30,false,27,604,https://dummyimage.com/938x594,0,remain sign send
00b42bad-c8cf-4ff2-99df-ec3938307fa9,accept,Consider data challenge keep against. Seek serve agency cover answer discussion attack. Story plant message huge lead. Trouble tough office grow prevent moment history suggest.,14.850,28d358a7-31f4-4d3f-b652-f46931dec98d,false,false,television at employee lead set,2024-06-26,false,21,867,https://picsum.photos/190/220,3,black forward suggest
95ce85a4-2a86-4131-917d-b44022e8cdce,appear,"Music machine road city. Leg spring artist imagine painting. Build same none ball.
Role officer customer his forward manager fact.
Us purpose week physical.",7.520,1a75c5df-8db8-4de0-af21-3a0295887a19,true,false,help knowledge day step loss,2024-02-07,false,15,788,https://picsum.photos/375/18,0,six attorney political
86113016-1ad5-4083-b870-b0a9c2cb5531,really,"Scientist point station player available surface benefit. Vote stand toward evening Congress high peace.
Say do type rather new drive morning. Direction senior do happy education.",17.530,0906009a-5640-4624-9c1d-7e9cd789a266,false,false,prepare relationship rate at law,2024-07-01,false,8,166,https://dummyimage.com/569x24,3,create service improve
b35f657d-0a07-477e-b5aa-9124f4e49c95,run,"Huge thus music garden everybody life. Although write cause region paper.
Find edge boy.
Economy sense build executive. Ago situation she bar bring themselves huge close.",9.180,28d358a7-31f4-4d3f-b652-f46931dec98d,false,false,them budget president exactly suggest,2024-03-31,true,29,608,https://dummyimage.com/122x537,1,kind enough pull
1fef7ce7-3a6c-4fba-9986-6e88026948ef,remember,"Test space cover adult history rate. Hope forward more occur whose future real vote.
Article friend maintain particularly room. Because image even main ready every on.",9.000,0906009a-5640-4624-9c1d-7e9cd789a266,true,false,American rock reveal never stand,2024-01-03,false,16,862,https://placekitten.com/353/143,3,style feeling money
e0fde928-8dd1-471d-81b8-257e7bedaf4e,this,"Fight son magazine join once represent. Woman east road check school site develop. Arm recent chair number use at me.
Become stand try heart meeting goal one. Able forget be.",11.450,0906009a-5640-4624-9c1d-7e9cd789a266,true,true,change always oil only now,2024-06-11,false,24,680,https://placekitten.com/1010/7,0,happy big might
