id,name,description
ccc35a5d-ef76-47ba-abad-3bf50fb65587,Appetizers,Conference strong member great power worry doctor now. For friend fine push.
e60d426f-10dc-4707-a5d4-c84f59eb0779,Entrees,Media to throw participant. Mouth institution key performance.
7d5ce61f-25f0-4c34-a505-0520395b59d9,Sides,Treat stage seat. Authority economic still.
53fc6f0a-b26e-4167-badb-0f730966142f,Desserts,Begin couple oil ever nature life type. Star note building civil meet.
78a22c09-eeef-4160-b63e-0e2cafd3d04f,Beverages,Ok wrong hold manager loss radio former. Energy close green the those prove themselves.
